Enter password: *****
Welcome to the MySQL monitor.  Commands end with ; or \g.
Your MySQL connection id is 4
Server version: 5.5.62 MySQL Community Server (GPL)

Copyright (c) 2000, 2018, Oracle and/or its affiliates. All rights reserved.

Oracle is a registered trademark of Oracle Corporation and/or its
affiliates. Other names may be trademarks of their respective
owners.

Type 'help;' or '\h' for help. Type '\c' to clear the current input statement.

mysql> select * from mentees;
ERROR 1046 (3D000): No database selected
mysql> use college;
Database changed
mysql> show tables;
+-------------------+
| Tables_in_college |
+-------------------+
| faculty           |
| mentees           |
+-------------------+
2 rows in set (0.00 sec)

mysql> select * from mentees;
+-----------+---------+------+---------+------------+---------+
| Regno     | Name    | Dept | Address | Fathername | Subject |
+-----------+---------+------+---------+------------+---------+
| 192011196 | jayanth | CSE  | HYD     | Siva       | DBMS    |
| 192011197 | mahesh  | CSE  | KDP     | Somesh     | DAA     |
| 192011198 | ramesh  | EEE  | PDT     | Suresh     | OOAD    |
| 192011199 | raghava | ECE  | ONG     | mani       | AI      |
+-----------+---------+------+---------+------------+---------+
4 rows in set (0.00 sec)

mysql> create table mendept(depid int(20),depname varchar(20),depmembers int(20));
Query OK, 0 rows affected (0.02 sec)

mysql> insert into mendept values(1,"CSE",19);
Query OK, 1 row affected (0.01 sec)

mysql> insert into mendept values(2,"EEE",21);
Query OK, 1 row affected (0.01 sec)

mysql> insert into mendept values(3,"ECE",24);
Query OK, 1 row affected (0.00 sec)

mysql> insert into mendept values(4,"BME",25);
Query OK, 1 row affected (0.01 sec)

mysql> select * from mendept;
+-------+---------+------------+
| depid | depname | depmembers |
+-------+---------+------------+
|     1 | CSE     |         19 |
|     2 | EEE     |         21 |
|     3 | ECE     |         24 |
|     4 | BME     |         25 |
+-------+---------+------------+
4 rows in set (0.00 sec)

mysql> update mendept set depname="IT" where depid=3;
Query OK, 1 row affected (0.01 sec)
Rows matched: 1  Changed: 1  Warnings: 0

mysql> select * from mendept;
+-------+---------+------------+
| depid | depname | depmembers |
+-------+---------+------------+
|     1 | CSE     |         19 |
|     2 | EEE     |         21 |
|     3 | IT      |         24 |
|     4 | BME     |         25 |
+-------+---------+------------+
4 rows in set (0.00 sec)

mysql> create table mentees(Rollno int(20));
ERROR 1050 (42S01): Table 'mentees' already exists
mysql> update mendept set depname=CSE where depid=192011196;
ERROR 1054 (42S22): Unknown column 'CSE' in 'field list'
mysql> update mendept set depname="CSE" where depid=192011196;
Query OK, 0 rows affected (0.00 sec)
Rows matched: 0  Changed: 0  Warnings: 0

mysql> select * from mendept;
+-------+---------+------------+
| depid | depname | depmembers |
+-------+---------+------------+
|     1 | CSE     |         19 |
|     2 | EEE     |         21 |
|     3 | IT      |         24 |
|     4 | BME     |         25 |
+-------+---------+------------+
4 rows in set (0.00 sec)

mysql> update mendept set depid=192011196 where depname="CSE";
Query OK, 1 row affected (0.04 sec)
Rows matched: 1  Changed: 1  Warnings: 0

mysql> select * from mendept;
+-----------+---------+------------+
| depid     | depname | depmembers |
+-----------+---------+------------+
| 192011196 | CSE     |         19 |
|         2 | EEE     |         21 |
|         3 | IT      |         24 |
|         4 | BME     |         25 |
+-----------+---------+------------+
4 rows in set (0.00 sec)

mysql> select depid,depname,depid from mendept,mentees where mentees.Regno=mendept.depid;
+-----------+---------+-----------+
| depid     | depname | depid     |
+-----------+---------+-----------+
| 192011196 | CSE     | 192011196 |
+-----------+---------+-----------+
1 row in set (0.00 sec)

mysql> select depid,depname,depmembers from mendept,mentees where mentees.Regno=mendept.depid;
+-----------+---------+------------+
| depid     | depname | depmembers |
+-----------+---------+------------+
| 192011196 | CSE     |         19 |
+-----------+---------+------------+
1 row in set (0.00 sec)

mysql> select Regno,Name,Dept,Address from mentees left outer join mentees on
mendept.depid=mentees.Regno;
ERROR 1066 (42000): Not unique table/alias: 'mentees'
mysql> select Regno,Name,Dept,Address from mentees left outer join mendept on mentees.Regno=mendept.depid;
+-----------+---------+------+---------+
| Regno     | Name    | Dept | Address |
+-----------+---------+------+---------+
| 192011196 | jayanth | CSE  | HYD     |
| 192011197 | mahesh  | CSE  | KDP     |
| 192011198 | ramesh  | EEE  | PDT     |
| 192011199 | raghava | ECE  | ONG     |
+-----------+---------+------+---------+
4 rows in set (0.01 sec)

mysql>